<?xml version="1.0" encoding="UTF-8" ?> 
<adressliste xmlns:xsi="http://www.w3.org/2001/XMLSchema-instance" xsi:noNamespaceSchemaLocation=".\adressen02.xsd">
	<adresse>
		<name>muster</name> 
		<vorname>hans</vorname> 
		<strasse>mustergasse</strasse> 
		<hausnummer>20</hausnummer> 
		<telefonnummer>+4143222222222</telefonnummer> 
		<kinder>
			<kind>
				<vorname>Peter</vorname>
				<geburtsjahr>1995</geburtsjahr>
			</kind>
			<kind>
				<vorname>egon</vorname>
				<geburtsjahr>1890</geburtsjahr>
			</kind>
		</kinder>
	</adresse>
	<adresse>
		<name>studer</name> 
		<vorname>eva</vorname> 
		<strasse>stadtgasse</strasse> 
		<hausnummer>15</hausnummer> 	
	</adresse>
</adressliste>